{"__comment":"UTF-8",
    "schema_ida": "cb",
    "schema_volta": "edgv",
    "afixo_geom_ida": {
      "tipo": "sufixo",
      "POINT": "_p",
      "LINESTRING": "_l",
      "POLYGON": "_a"
    },
    "afixo_geom_volta": {
        "tipo": "sufixo",
        "POINT": "_p",
        "LINESTRING": "_l",
        "POLYGON": "_a"
      },
    "agregar_geom_ida": true,
    "agregar_geom_volta": true,
    "mapeamento_classes": [
        {"__comment":"veg_brejo_pantano <-> veg_brejo_pantano",
            "classe_ida":"veg_brejo_pantano",
            "classe_volta":"veg_brejo_pantano",
            "atributos_default_ida":[
                {"nome_atributo":"secundaria", "valor":95}],
            "mapeamento_atributos":[
                {"attr_ida": "denso","attr_volta": "densidade",
                    "traducao":[{"valor_ida": 0, "valor_volta": 95}]
                }
            ]
        },
        {"__comment":"veg_caatinga <-> veg_caatinga",
            "classe_ida":"veg_caatinga",
            "classe_volta":"veg_caatinga",
            "atributos_default_ida":[{"nome_atributo":"secundaria", "valor":95}],
            "mapeamento_atributos":[
                {"attr_ida": "denso","attr_volta": "densidade",
                    "traducao":[{"valor_ida": 0, "valor_volta": 95}]
                }
            ]
        },
        {"__comment":"veg_campinarana <-> veg_campinarana",
            "classe_ida":"veg_campinarana",
            "classe_volta":"veg_campinarana",
            "atributos_default_ida":[{"nome_atributo":"secundaria", "valor":95}],
            "mapeamento_atributos":[
                {"attr_ida": "denso","attr_volta": "densidade",
                    "traducao":[{"valor_ida": 0, "valor_volta": 95}]
                }
            ]
        },
        {"__comment":"veg_campo <-> veg_campo",
            "classe_ida":"veg_campo",
            "classe_volta":"veg_campo",
            "atributos_default_ida":[
                {"nome_atributo":"secundaria", "valor":95},
                {"nome_atributo":"antropizada", "valor":95},
                {"nome_atributo":"classificacaoporte", "valor":95},
                {"nome_atributo":"densidade", "valor":2}
            ],
            "atributos_default_volta":[{"nome_atributo":"ocorrenciaem", "valor":96}]
        },
        {"__comment":"veg_estepe --> veg_campo",
            "classe_ida":"veg_estepe",
            "classe_volta":"veg_campo",
            "atributos_default_ida":[
                {"nome_atributo":"secundaria", "valor":95},
                {"nome_atributo":"antropizada", "valor":95},
                {"nome_atributo":"classificacaoporte", "valor":95},
                {"nome_atributo":"densidade", "valor":2}
            ]
        },
        {"__comment":"veg_macega_chavascal --> veg_campo",
            "classe_ida":"veg_macega_chavascal",
            "classe_volta":"veg_campo",
            "atributos_default_ida":[
                {"nome_atributo":"secundaria", "valor":95},
                {"nome_atributo":"tipocampo", "valor":1},
                {"nome_atributo":"densidade", "valor":2}
            ]
        },
        {"__comment":"veg_cerrado_cerradao <-> veg_cerrado",
            "classe_ida":"veg_cerrado_cerradao",
            "classe_volta":"veg_cerrado",
            "atributos_default_ida":[
                {"nome_atributo":"secundaria", "valor":95},
                {"nome_atributo":"vereda", "valor":9999}
            ],
            "mapeamento_atributos":[
                {"attr_ida": "denso","attr_volta": "densidade",
                    "traducao":[{"valor_ida": 0, "valor_volta": 95}]
                }
            ]
        },
        {"__comment":"veg_floresta <-> veg_floresta",
            "classe_ida":"veg_floresta",
            "classe_volta":"veg_floresta",
            "atributos_default_ida":[{"nome_atributo":"secundaria", "valor":95}],
            "atributos_default_volta":[{"nome_atributo":"caracteristicafloresta", "valor":0}],
            "mapeamento_atributos":[
                {"attr_ida": "denso","attr_volta": "densidade",
                    "traducao":[{"valor_ida": 0, "valor_volta": 95}]
                }
            ]
        },
        {"__comment":"veg_mangue <-> veg_mangue",
            "classe_ida":"veg_mangue",
            "classe_volta":"veg_mangue",
            "atributos_default_ida":[
                {"nome_atributo":"secundaria", "valor":95},
                {"nome_atributo":"tipomanguezal", "valor":95}
            ],
            "mapeamento_atributos":[
                {"attr_ida": "denso","attr_volta": "densidade"}
            ]
        },
        {"__comment":"veg_area_contato <-> veg_area_contato",
            "classe_ida":"veg_area_contato",
            "classe_volta":"veg_area_contato",
            "atributos_default_ida":[
                {"nome_atributo":"secundaria", "valor":95},
                {"nome_atributo":"tipoveg", "valor":95}
            ],
            "mapeamento_atributos":[
                {"attr_ida": "denso","attr_volta": "densidade",
                    "traducao":[{"valor_ida": 0, "valor_volta": 95}]
                }
            ]
        },
        {"__comment":"veg_veg_cultivada <-> veg_veg_cultivada",
            "classe_ida":"veg_veg_cultivada",
            "classe_volta":"veg_veg_cultivada",
            "atributos_default_volta":[{"nome_atributo":"denso", "valor":0}]
        },
        {"__comment":"veg_veg_cultivada <-- veg_reflorestamento",
            "classe_ida":"veg_veg_cultivada",
            "classe_volta":"veg_reflorestamento",
            "sentido": "volta",
            "atributos_default_volta":[{"nome_atributo":"denso", "valor":0}]
        },
        {"__comment":"veg_veg_restinga <-> veg_veg_restinga",
            "classe_ida":"veg_veg_restinga",
            "classe_volta":"veg_veg_restinga",
            "atributos_default_ida":[{"nome_atributo":"secundaria", "valor":95}],
            "mapeamento_atributos":[
                {"attr_ida": "denso","attr_volta": "densidade",
                    "traducao":[{"valor_ida": 0, "valor_volta": 95}]
                }
            ]
        },

        {"__comment":"hid_massa_dagua <-> hid_massa_dagua",
            "classe_ida":"hid_massa_dagua",
            "classe_volta":"hid_massa_dagua",
            "filtro_volta":{"nome_atributo": "possuitrechodrenagem", "valor": 0},
            "atributos_default_ida":[
                {"nome_atributo":"dominialidade", "valor":95},
                {"nome_atributo":"artificial", "valor":95},
                {"nome_atributo":"possuitrechodrenagem", "valor":0}
            ],
            "mapeamento_atributos":[
                {"attr_ida": "salinidade","attr_volta": "salgada",
                    "traducao":[
                        {"valor_ida": 0, "valor_volta": 95},
                        {"valor_ida": 1, "valor_volta": 0},
                        {"valor_ida": 2, "valor_volta": 1}
                    ]
                }
            ]
        },
        {"__comment":"hid_trecho_massa_dagua <-> hid_massa_dagua",
            "classe_ida":"hid_trecho_massa_dagua",
            "classe_volta":"hid_massa_dagua",
            "filtro_ida":{
                "$not":{"nome_atributo": "tipotrechomassa", "valor": 2}
            },
            "filtro_volta":{"nome_atributo": "possuitrechodrenagem", "valor": 1},
            "atributos_default_ida":[
                {"nome_atributo":"dominialidade", "valor":95},
                {"nome_atributo":"artificial", "valor":95},
                {"nome_atributo":"possuitrechodrenagem", "valor":1}
            ],
            "mapeamento_atributos":[
                {"attr_ida": "tipotrechomassa","attr_volta": "tipomassadagua"},
                {"attr_ida": "salinidade","attr_volta": "salgada",
                    "traducao":[
                        {"valor_ida": 0, "valor_volta": 95},
                        {"valor_ida": 1, "valor_volta": 0},
                        {"valor_ida": 2, "valor_volta": 1}
                    ]
                }
            ]
        },
        {"__comment":"hid_trecho_massa_dagua <-> hid_canal",
            "classe_ida":"hid_trecho_massa_dagua",
            "classe_volta":"hid_canal",
            "filtro_ida":{"nome_atributo": "tipotrechomassa", "valor": 2},
            "atributos_default_ida":[
                {"nome_atributo":"finalidade", "valor":9999},
                {"nome_atributo":"geometriaaproximada", "valor":0},
                {"nome_atributo":"matconstr", "valor":9999},
                {"nome_atributo":"operacional", "valor":1},
                {"nome_atributo":"situacaofisica", "valor":7},
                {"nome_atributo":"tipoalterantrop", "valor":30},
                {"nome_atributo":"usoprincipal", "valor":9999}
            ],
            "atributos_default_volta":[
                {"nome_atributo":"tipotrechomassa", "valor":2},
                {"nome_atributo":"regime", "valor":1},
                {"nome_atributo":"salinidade", "valor":0}
            ]
        },
        {"__comment":"hid_bacia_hidrografica --> hid_massa_dagua",
            "classe_ida":"hid_bacia_hidrografica",
            "classe_volta":"hid_massa_dagua",
            "sentido":"ida",
            "atributos_default_ida":[
                {"nome_atributo":"dominialidade", "valor":95},
                {"nome_atributo":"artificial", "valor":0},
                {"nome_atributo":"possuitrechodrenagem", "valor":9999},
                {"nome_atributo":"regime", "valor":9999},
                {"nome_atributo":"salgada", "valor":9999},
                {"nome_atributo":"tipomassadagua", "valor":99}
            ]
        },
        {"__comment":"hid_barragem <-> hid_barragem",
            "classe_ida":"hid_barragem",
            "classe_volta":"hid_barragem",
            "atributos_default_ida":[
                {"nome_atributo":"dominialidade", "valor":95},
                {"nome_atributo":"artificial", "valor":95},